id,bid,user_id,用户昵称,微博正文,头条文章url,发布位置,艾特用户,话题,转发数,评论数,点赞数,发布时间,发布工具,微博图片url,微博视频url,retweet_id,八种情感分析
4471293095506341,ItUERn6rX,1672519561,东方今报,【又又又来了！#2万吨中央储备冻猪肉将投放市场#】2月12日，华储网发布通知称，根据相关部委要求，华商储备商品管理中心有限公司将于2月14日开展中央储备冻猪肉投放2万吨竞价交易。为加强新冠肺炎防控工作，有效减少人员聚集，阻断疫情传播，交易企业应通过远程方式进行交易，不宜到现场交易大厅进行交易，并提前做好设备和系统调试。截至2月12日，2019年9月以来，华商储备商品管理中心已累计投放超28万吨中央储备冻猪肉。（中国新闻网）,,,,2万吨中央储备冻猪肉将投放市场,1,0,4,2020-02-12 23:53,Android,['http://ww4.sinaimg.cn/large/63b09f89ly1gbu212p131j20jg0rsjtj.jpg'],,,"{'words': 124, 'sentences': 5, '好': 1, '乐': 2, '哀': 0, '怒': 0, '惧': 0, '恶': 1, '惊': 0}"
4471293090945801,ItUER3Y2R,1466049823,Jackieyang80,主上2月3日曾警告高层官员说，遏制新冠病毒的努力已做得太过，威胁到中国经济，敦促地方官员避免采取“更多的限制措施”。,,,,,0,0,1,2020-02-12 23:53,iPhone客户端,,,,"{'words': 39, 'sentences': 2, '好': 0, '乐': 0, '哀': 0, '怒': 0, '惧': 1, '恶': 1, '惊': 0}"
4471293087095644,ItUEQtLTS,3901523762,望城之声,【关于新冠肺炎，你想了解的都在这里！官方问答库上线】为便于大家掌握正确的疫情防控知识，中国政府网联合健康中国（国家卫健委政务新媒体平台）推出【新型冠状病毒肺炎疫情防控知识库】。详情：O关于新冠肺炎，你想了解的都在这里！官方问答库上线,,,,,0,0,1,2020-02-12 23:53,iPhone客户端,['http://ww2.sinaimg.cn/large/e88c8732gy1gbu20tpnplj20u01s57wh.jpg'],,,"{'words': 70, 'sentences': 4, '好': 1, '乐': 1, '哀': 0, '怒': 0, '惧': 0, '恶': 0, '惊': 0}"
4471293082535164,ItUEQaDvK,5236442064,翠屏青年,【莲花对樱花的祝福，澳大学子原创MV为武汉打气】@澳门大学的同学们，原计划要为@武汉大学带来话剧《苦尽甘来》，如今这一心愿无法实现。13首歌，2位同学，一个星期完成改编，用全新制作的《苦尽甘来》MV，送上莲花对樱花的祝福。待樱花开满下一季，愿我们能相聚。L澳门大学学生会戏剧社的微博视频#张流波所有消毒剂对新冠病毒都有效#,,,"澳门大学,武汉大学",张流波 所有消毒剂对新冠病毒都有效,0,0,0,2020-02-12 23:53,正能量 · 视频社区,,"http://f.video.weibocdn.com/004yqtOslx07AHcsvxfy010412013SI10E010.mp4?label=mp4_ld&template=640x360.25.0&trans_finger=bdef57f06ae52835a2c783ca389e8517&ori=0&ps=1BVp4ysnknHVZu&Expires=1611148489&ssig=%2BrC7NRSvHj&KID=unistore,video",,"{'words': 96, 'sentences': 4, '好': 5, '乐': 2, '哀': 1, '怒': 0, '惧': 1, '恶': 0, '惊': 0}"
4471293074725463,ItUEPjPj9,5075401594,给谢景行打call,#张流波所有消毒剂对新冠病毒都有效#已经不知道听谁的了。。。消毒液退了，再买都下不了单。。。,,,,张流波 所有消毒剂对新冠病毒都有效,0,5,3,2020-02-12 23:53,iPhone客户端,,,,"{'words': 33, 'sentences': 3, '好': 1, '乐': 0, '哀': 0, '怒': 0, '惧': 1, '恶': 1, '惊': 0}"
4471293053673008,ItUENfpw4,3211941975,武钢叶少雄,少儿美术用画笔记录“抗疫战士”：武钢炼铁厂退休职工林义德用自己手中的画笔，创作了色粉画《众志成城共抗疫情》系列作品，表达了对抗击新冠病毒疫情英雄们的由衷敬意。（5060）,,,,,6,0,13,2020-02-12 23:53,少儿美术超话,"['http://ww3.sinaimg.cn/large/bf725857gy1gbu1y03f11j20u013rjxr.jpg', 'http://ww4.sinaimg.cn/large/bf725857gy1gbu1y0snm5j20u016cjw6.jpg', 'http://ww4.sinaimg.cn/large/bf725857gy1gbu1y17mllj20g60m8gnr.jpg', 'http://ww2.sinaimg.cn/large/bf725857gy1gbu1y1qh7xj20u00laq7r.jpg', 'http://ww2.sinaimg.cn/large/bf725857gy1gbu1y2ehjgj20u015y108.jpg', 'http://ww2.sinaimg.cn/large/bf725857gy1gbu1y32ka0j20u0153ag4.jpg', 'http://ww4.sinaimg.cn/large/bf725857gy1gbu1y3m6r9j20u015z44i.jpg', 'http://ww2.sinaimg.cn/large/bf725857gy1gbu1y4fxtxj20u0153dp8.jpg', 'http://ww2.sinaimg.cn/large/bf725857gy1gbu1y52jg5j20u0153q80.jpg']",,,"{'words': 48, 'sentences': 2, '好': 4, '乐': 0, '哀': 0, '怒': 0, '惧': 1, '恶': 0, '惊': 0}"
4471293049192026,ItUEMCzgu,3230317920,陇南日报,#疫情防控甘肃在行动#【最新！2月12日甘肃新增1例新冠肺炎确诊病例，累计确诊87例】2月11日20时至2月12日20时，甘肃省甘南州新增1例新型冠状病毒肺炎确诊病例。新增治愈出院7例。截至2月12日20时，甘肃累计报告新型冠状病毒肺炎确诊病例87例。累计治愈出院31例，累计死亡病例2例，54例在定点医院进行隔离治疗。兰州市18例、平凉市7例、天水市6例、定西市6例、甘南州6例、白银市4例、陇南市3例、庆阳市2例、张掖市1例、临夏州1例。现有重型病例6例，危重型病例1例。新增疑似病例7例，平凉市6例、兰州市1例。现有疑似病例22例，平凉市9例、兰州市6例、甘南州3例、定西市2例、天水市2例。目前，累计追踪到密切接触者3583人，已解除医学观察2689人，其余894人正在接受医学观察。患者，王某，女性，53岁，陕西省淳化县人，现居住甘南州合作市。与2月1日确诊病例黎某居住同一单元。2月4日出现发热、咽干、干咳，在家自行服药后未见缓解，2月11日到甘南州人民医院就诊后隔离治疗。2月12日确诊为新型冠状病毒肺炎。目前，在甘南州人民医院住院隔离治疗，病情平稳。#关注新型冠状病毒肺炎疫情##新型冠状病毒感染肺炎#（来源：甘肃省卫生健康委员会官网）O最新！2月12日甘肃新增1例新冠肺炎确诊病例，累计确诊87例@新浪甘肃@微博甘肃@人民网甘肃频道@甘肃公安,,,"新浪甘肃,微博甘肃,人民网甘肃频道,甘肃公安","疫情防控 甘肃在行动,关注新型冠状病毒肺炎疫情,新型冠状病毒感染肺炎",2,0,1,2020-02-12 23:53,iPhone客户端,['http://ww4.sinaimg.cn/large/c08abd60ly1gbu20wyciyj20j6085mxm.jpg'],,,"{'words': 347, 'sentences': 17, '好': 4, '乐': 2, '哀': 1, '怒': 0, '惧': 8, '恶': 2, '惊': 0}"
4471293044678439,ItUEMjD4H,5242724548,Kathleen__,#新我gmat自学计划#阅读能力训练day19刚看完寄生虫就收到我导发来的修改论文建议和爱宝的新冠群发邮件，心情复杂,,,,新我gmat自学计划,0,5,2,2020-02-12 23:53,小米8周年旗舰手机,"['http://ww4.sinaimg.cn/large/005INW9mly1gbu20vhhd4j30u01qgdr8.jpg', 'http://ww1.sinaimg.cn/large/005INW9mly1gbu20vt30ej30ii0hstaf.jpg']",,,"{'words': 31, 'sentences': 1, '好': 0, '乐': 0, '哀': 0, '怒': 0, '惧': 0, '恶': 2, '惊': 0}"
4471293036552787,ItUELruG7,3121654893,hy75060,钻石公主号邮轮上被确诊感染新冠肺炎的174名患者中，有4名患者病情发生了恶化，转移至指定医院接受集中治疗，据悉，4人全部需要人工呼吸机。▲“钻石公主”号邮轮每天的新增病例数，牵动无数人的心。图据《纽约时报》此外，鉴于从1月底至3月底取消赴日旅游的中国团体游客预计超40万人，12日，日本首相安倍晋三表示，将考虑启用预备金来支援中小企业...O“钻石公主”号4名感染者病情恶化日本政府考虑启用医疗船,,,,,0,0,2,2020-02-12 23:53,小米MIX2S 全面屏,['http://ww1.sinaimg.cn/large/ba10ac6dgy1gbu20gvv5ij205c040ab6.jpg'],,,"{'words': 117, 'sentences': 4, '好': 0, '乐': 0, '哀': 0, '怒': 0, '惧': 1, '恶': 0, '惊': 0}"
4471293032624729,ItUELb0Ol,5872109838,陕西大事小事,#兰州生活##兰州万众一心全民战疫#【抗“疫”MV《你的答案》丨讲述甘肃文旅人的“爱与担当”】近日，由甘肃省文化和旅游厅出品，西北师范大学艺术学院师生演唱的抗“疫”MV——《你的答案》，用一个个真实感人的镜头，诉说着新冠肺炎疫情发生以来，甘肃旅游工作者在2020年初春留下的深深足印。这首MV不仅是一种记录，对于甘肃文旅人而言，更是一种力量、一种鼓舞。by@兰州晨报L兰州晨报的微博视频,,,兰州晨报,"兰州生活,兰州万众一心全民战疫",1,3,3,2020-02-12 23:53,MV · 视频社区,,"http://f.video.weibocdn.com/003xkdqBlx07ASqDvs8E01041200WhSO0E010.mp4?label=mp4_ld&template=640x360.25.0&trans_finger=bdef57f06ae52835a2c783ca389e8517&ori=0&ps=1BVp4ysnknHVZu&Expires=1611148489&ssig=MDKxpuCGQW&KID=unistore,video",,"{'words': 117, 'sentences': 3, '好': 3, '乐': 1, '哀': 0, '怒': 0, '惧': 0, '恶': 0, '惊': 0}"
4471293019706980,ItUEJEJec,5389134354,andyliuyang66,专家：新冠病毒可能与流感病毒混合感染，对疫情防控带来干扰O专家：新冠病毒可能与流感病毒混合感染，对疫情防控带来干扰,,,,,0,0,0,2020-02-12 23:53,内置浏览器,['http://ww2.sinaimg.cn/large/005SIg1Qgy1gbu20poiorj30go0kngnk.jpg'],,,"{'words': 31, 'sentences': 1, '好': 2, '乐': 0, '哀': 0, '怒': 0, '惧': 2, '恶': 2, '惊': 0}"
4471293015023175,ItUEJl4KX,6438902824,易辩君前,#防治新冠肺炎饮食指南#在2020年最长假期里，我学会了做包子、炸鸡翅、柠檬凤爪，烤面包……如果假期继续，估计还能学会做凉皮、电饭锅蛋糕、自制肠粉等等……在这场没有硝烟的“战疫”里，照顾好自己和家人，就是对社会最大的贡献。,,,,防治新冠肺炎饮食指南,3,8,13,2020-02-12 23:53,HUAWEI P20,"['http://ww1.sinaimg.cn/large/0071KYLmgy1gbu1vt9w0mj32ao3287wj.jpg', 'http://ww2.sinaimg.cn/large/0071KYLmgy1gbu1vwdw9vj32ao328b2b.jpg', 'http://ww3.sinaimg.cn/large/0071KYLmgy1gbu1vyalvlj32ao3287wj.jpg', 'http://ww4.sinaimg.cn/large/0071KYLmgy1gbu1w08gwaj32ao3287wj.jpg']",,,"{'words': 70, 'sentences': 2, '好': 1, '乐': 0, '哀': 0, '怒': 0, '惧': 0, '恶': 2, '惊': 0}"
4471293015500832,ItUEJn516,1844166435,2020-V,前两天苏州一工厂复工后，有一个工人确诊新冠，二百多工人都被拉出去隔离14天，复工的损失比不复工还大。O国务院常务会议：高度关注就业问题防止大规模裁员,,,,,0,0,3,2020-02-12 23:53,百度分享,['http://ww3.sinaimg.cn/large/6debbf23ly1gbu20qo7a5j20a50773zm.jpg'],,,"{'words': 42, 'sentences': 2, '好': 0, '乐': 0, '哀': 0, '怒': 0, '惧': 0, '恶': 1, '惊': 0}"
4471293015501029,ItUEJn54h,7272121074,卡子林_,刚刚看庆余年皇帝说要设宴君臣同庆我第一个想到的居然是多人聚集容易传播新冠肺炎,,,,,0,0,0,2020-02-12 23:53,Android,,,,"{'words': 22, 'sentences': 1, '好': 0, '乐': 0, '哀': 0, '怒': 0, '惧': 0, '恶': 0, '惊': 0}"
4471293007336378,ItUEIuMwG,5092474123,浙里传媒,#华媒头条#【#黄冈大别山首例妊娠合并新冠肺炎女子出院#医生巧用中西医诊疗取胜】患者吕女士妊娠8周，她于2月2日接受治疗，医生采用中西医结合治疗手法，并安排护理人员精心照料。随后，吕女士症状缓解，复测咽拭子，核酸2次呈阴性。医生叮嘱，她需要居家隔离2周，再就医评估妊娠情况。来源：L新京报我们视频的秒拍视频,,,,"华媒头条,黄冈大别山首例妊娠合并新冠肺炎女子出院",0,0,0,2020-02-12 23:53,iPhone客户端,,"http://miaopai.video.weibocdn.com/003aJxXxlx07AU7N86lO010412008v7m0E013.mp4?label=mp4_ld&template=640x360.25.0&trans_finger=40a32e8439c5409a63ccf853562a60ef&ori=0&ps=1BVp4ysnknHVZu&Expires=1611148489&ssig=wAN9vEsbnY&KID=unistore,video",,"{'words': 94, 'sentences': 4, '好': 0, '乐': 2, '哀': 0, '怒': 0, '惧': 1, '恶': 0, '惊': 0}"
4471293007612348,ItUEIvWjO,6122361514,英雄不再落伍,欲防新冠肺炎，必先劳其筋骨伤其体肤L英雄不再落伍的微博视频,,成都·仁恒滨河湾,,,0,0,0,2020-02-12 23:53,iPhone客户端,,"http://f.video.weibocdn.com/0045tkGDgx07AU7On4VF010412001Ify0E010.mp4?label=mp4_ld&template=360x640.24.0&trans_finger=81b11b8c5ffb62d33ceb3244bdd17e7b&ori=0&ps=1BVp4ysnknHVZu&Expires=1611148489&ssig=M4W7jSAodm&KID=unistore,video",,"{'words': 16, 'sentences': 1, '好': 1, '乐': 0, '哀': 0, '怒': 0, '惧': 0, '恶': 1, '惊': 0}"
4471293003134539,ItUEId9r5,1899824341,北京头条校园,#5名治愈者不愿离开方舱医院#【武昌方舱医院首批28名患者出院，医生：还有5个不愿意出来】2020年2月11日，武汉市洪山体育馆武昌方舱医院，首批新冠肺炎轻症患者经过治疗顺利出院。据了解，首批共28个患者出院，年龄最小25岁，最大69岁。治愈者们激动喊话，对医护表达了感谢，医生称还有5名治愈者不愿出院。@一手VideoL一手video的秒拍视频,,,一手Video,5名治愈者不愿离开方舱医院,0,0,1,2020-02-12 23:53,iPhone 6 Plus,,"http://miaopai.video.weibocdn.com/000rYZRBlx07ASpaBs4E01041200piqm0E013.mp4?label=mp4_ld&template=640x360.25.0&trans_finger=40a32e8439c5409a63ccf853562a60ef&ori=0&ps=1BVp4ysnknHVZu&Expires=1611148489&ssig=p%2BHUNQblP6&KID=unistore,video",,"{'words': 103, 'sentences': 4, '好': 1, '乐': 2, '哀': 0, '怒': 0, '惧': 0, '恶': 0, '惊': 0}"
4471292998915151,ItUEHBpeL,5944257999,精美优信,重磅！十堰市张湾区今夜零时起实施战时管制，所有楼栋封闭管理十堰市张湾区新冠肺炎疫情防控指挥部发布第27号通告宣布张湾区全域从2月12日24:00起实施战时管制所有楼栋一律实施全封闭管理管制措施原则上以14天为一周期视全市及张湾区疫情防控效果予以提前解除或持续实施,,,,,0,0,0,2020-02-12 23:53,iPhone客户端,,,,"{'words': 69, 'sentences': 2, '好': 0, '乐': 1, '哀': 0, '怒': 0, '惧': 0, '恶': 0, '惊': 0}"
4471292998926818,ItUEHBsgW,5738003358,JELLY_L哈,#张流波所有消毒剂对新冠病毒都有效#洗衣服那种滴露消毒液有用吗？,,,,张流波 所有消毒剂对新冠病毒都有效,0,10,12,2020-02-12 23:53,iPhone客户端,,,,"{'words': 16, 'sentences': 2, '好': 1, '乐': 0, '哀': 0, '怒': 0, '惧': 1, '恶': 0, '惊': 0}"
4471292990778789,ItUEH3gB7,5174616196,Carriekerry_,再不上班可能就废在家了新冠啥子时候才是个头吖🦠,,,,,0,3,2,2020-02-12 23:53,iPhone客户端,['http://ww2.sinaimg.cn/large/005Eca3ygy1gbu1yebthej31o01o0hdt.jpg'],,,"{'words': 16, 'sentences': 1, '好': 0, '乐': 0, '哀': 0, '怒': 0, '惧': 0, '恶': 0, '惊': 0}"
4471292990257391,ItUEH14Xt,2485817127,德州发布,#德州企业复工复产#李猛调研督导中心城区重点项目开工复工工作：加快推进重点项目开工复工坚决打赢疫情防控总体战2月12日下午，市委书记、市新冠肺炎疫情防控工作领导小组组长李猛在中心城区调研督导重点项目开工复工工作。他强调，要在疫情防控决心不变、劲头不松、力度不减前提下，支持具备条件的企业迅速复工复产、项目尽快开工建设，坚决打赢疫情防控总体战。李猛先后查看实华化工无汞新工艺改造40万吨PVC装置节能减排、华源生态科技智能化高性能纤维高端定制生产线、中机寰宇新能源汽车认证检测公共服务平台、创加高端人才创业园、氢普新能源科技国产燃料电池电堆产业化、晶创新材料科技5万吨超强细旦高分子防粘复合新材料、华能德州新能源风光储一体发电等7个省、市重点项目。目前这些项目均因用工、物资运输等原因，暂未复工开工。在项目现场，李猛与项目负责人深入交流，详细了解项目规划、开工准备情况等，引导他们打消顾虑、鼓足信心，现场调度督促有关部门为企业解决实际困难和问题。李猛指出，重点项目建设事关经济发展大局，事关社会稳定。各级各有关部门要认真执行中央、省有关要求，正确处理好疫情防控和重点项目建设的关系，在严格落实疫情防控措施、保障安全生产前提下，积极推动具备条件的项目迅速复工开工，努力推动疫情防控和重点项目建设两手抓、两不误。要坚持“一企一策”，分类施治，帮助项目单位积极破解土地、资金、手续、市场及配套设施等要素瓶颈制约，坚决破除错误认识，坚决化解消极情绪，以更大力度、更实举措为项目复工开工扫清障碍。各开发区要充分发挥经济发展“主阵地”作用，推动园区企业抓紧复工复产。要落实“四个一批”要求，抓紧抓实各类项目储备开工建设，持续扩大有效投资，确保一季度集中落地一批，确保完成年度投资计划。对已签约的招引项目要抓好跟踪落实，促进项目早开工、早投产、早达效。李猛强调，项目单位要不等不靠，克服困难，尽快开工复产，加快建设步伐，科学精准施工，全力抢工期、抢进度、抢机遇，努力把疫情造成的损失抢回来，争取项目早日投产达效。要按照科学、合理、适度、管用原则，制定科学完善的疫情防护复工方案，明确疫情防控应急预案和工作措施，全力保障工作人员身体健康和生命安全。要强化安全意识、质量意识，在疫情防控压力下始终确保项目质量和施工安全。,,,,德州企业复工复产,0,0,1,2020-02-12 23:53,HUAWEI P30,"['http://ww2.sinaimg.cn/large/942a8f27ly1gbu20hb0pqj20zk0qotg6.jpg', 'http://ww2.sinaimg.cn/large/942a8f27ly1gbu20ht3xwj20zk0qotdz.jpg', 'http://ww3.sinaimg.cn/large/942a8f27ly1gbu20iqeu3j20zk0qoq9v.jpg', 'http://ww1.sinaimg.cn/large/942a8f27ly1gbu20k9vbcj20zk0qoqbf.jpg', 'http://ww4.sinaimg.cn/large/942a8f27ly1gbu20ky70zj20zk0qo7bt.jpg', 'http://ww3.sinaimg.cn/large/942a8f27ly1gbu20nayeuj20zk0qoq90.jpg', 'http://ww2.sinaimg.cn/large/942a8f27ly1gbu20oa0p4j20zk0qoq9x.jpg']",,,"{'words': 521, 'sentences': 15, '好': 42, '乐': 4, '哀': 0, '怒': 0, '惧': 2, '恶': 2, '惊': 0}"
4471292986559092,ItUEGrwjO,1847123567,香港商報網,#关注新冠肺炎#【中日友好医院：正在针对瑞德西韦开展临床实验研究工作】12日，湖北省召开新闻发布会，中日友好医院党委书记周军表示，截至目前，中日友好医院已经连续派出5批队伍，共153名队员在武汉，一支队伍在同济医院中法新区院区对部分重症患者开展救治任务；第二支队伍承担武汉客厅方舱医院针对普通的感染者的医疗任务。中日友好医院现在由曹彬副院长牵头在开展针对药物，特别是瑞德西韦这样的药物开展临床实验研究工作。L中新视频的秒拍视频,,,,关注新冠肺炎,5,4,20,2020-02-12 23:53,微博 weibo.com,,"http://miaopai.video.weibocdn.com/0029zqXxlx07AU2Dgz2E01041200591i0E013.mp4?label=mp4_ld&template=640x360.25.0&trans_finger=40a32e8439c5409a63ccf853562a60ef&ori=0&ps=1BVp4ysnknHVZu&Expires=1611148489&ssig=YjUVruHZJi&KID=unistore,video",,"{'words': 111, 'sentences': 4, '好': 1, '乐': 5, '哀': 0, '怒': 0, '惧': 0, '恶': 0, '惊': 0}"
4471292973431516,ItUEFeoH2,2322701991,Nort,NCP第五版诊疗方案明确说了氯己定不行这又来给大众散布这么vague的理论#张流波所有消毒剂对新冠病毒都有效#,,,,张流波 所有消毒剂对新冠病毒都有效,0,3,18,2020-02-12 23:53,iPhone客户端,,,,"{'words': 30, 'sentences': 1, '好': 1, '乐': 0, '哀': 1, '怒': 0, '惧': 1, '恶': 0, '惊': 0}"
4471292960806780,ItUEE3nSA,5935575704,准优秀先生,微信查看新冠确诊患者是否同小区或最近距离的方法,,,,,0,0,0,2020-02-12 23:52,iPhone客户端,"['http://ww3.sinaimg.cn/large/006tH4o0gy1gbu1z8m6i3j30v91votjd.jpg', 'http://ww4.sinaimg.cn/large/006tH4o0gy1gbu1z7cl5xj30v91vowsk.jpg', 'http://ww3.sinaimg.cn/large/006tH4o0gy1gbu1zay1e7j30v91vo7wh.jpg']",,,"{'words': 13, 'sentences': 1, '好': 0, '乐': 0, '哀': 0, '怒': 0, '惧': 0, '恶': 0, '惊': 0}"
4471292960574335,ItUEE2ppt,2684695291,行观yan,有人的地方就有江湖有兽的地方也有有江湖的地方就有新冠病毒和衍生物 以为惨重的代价能换来一点教训其实除了水落石出和忘恩负义人已经不是人兽更是兽,,,,,0,0,3,2020-02-12 23:52,OPPO R9,,,,"{'words': 41, 'sentences': 1, '好': 1, '乐': 1, '哀': 1, '怒': 0, '惧': 1, '恶': 2, '惊': 0}"
4471292957079456,ItUEDtHGM,3877066812,张世林,晚安大家好，我是心理咨询师世林，新冠肺炎疫情之下，您在家里待了多少天了呢？欢迎留言，感谢关注～L张世林的微博视频,,临沂,,,0,0,0,2020-02-12 23:52,晚安超话,,"http://f.video.weibocdn.com/000B0UnIlx07AU7Nv0Yw010412001Yg70E010.mp4?label=mp4_ld&template=360x640.24.0&trans_finger=81b11b8c5ffb62d33ceb3244bdd17e7b&ori=0&ps=1BVp4ysnknHVZu&Expires=1611148492&ssig=AzrRqgfpq4&KID=unistore,video",,"{'words': 35, 'sentences': 2, '好': 2, '乐': 0, '哀': 0, '怒': 0, '惧': 0, '恶': 0, '惊': 0}"
4471292952150385,ItUED91pD,6329705013,sunshine67990,【牢记嘱托】省新冠肺炎防控领导小组召开全省视频会议O【牢记嘱托】省新冠肺炎防控领导小组召开全省视频会议,,,,,0,0,0,2020-02-12 23:52,学习强国客户端,['http://ww2.sinaimg.cn/large/006UmNqlgy1gbu20gllp8j30460463yc.jpg'],,,"{'words': 23, 'sentences': 1, '好': 2, '乐': 0, '哀': 0, '怒': 0, '惧': 0, '恶': 0, '惊': 0}"
4471292944454694,ItUECiGRU,5710060838,我的天200503,这次新冠肺炎的病源查清楚了吗？病源肯定是野生动物，我认为到底是哪种野生动物还需查找。,,焦作·温县,,,0,0,0,2020-02-12 23:52,三星android智能手机,,,,"{'words': 25, 'sentences': 3, '好': 1, '乐': 0, '哀': 0, '怒': 0, '惧': 0, '恶': 0, '惊': 0}"
4471292939772026,ItUEBF09k,1649173367,每日经济新闻,#战疫实录#【图集|实拍武汉小区封闭管理现状居民外出需填卡登记】2月11日凌晨，武汉市新冠肺炎疫情防控指挥部发布第12号通告，要求武汉所有住宅小区实行封闭管理，以此进一步加强源头管控，最大限度减少人员流动，坚决阻断疫情扩散。2月12日下午，《每日经济新闻》记者用镜头记录下武汉市住宅小区封闭管理第二天的管控情况。O图集|实拍武汉小区封闭管理现状居民外出需填卡登记,,,,战疫实录,17,42,56,2020-02-12 23:52,微博 weibo.com,"['http://ww2.sinaimg.cn/large/624c6377gy1gbu1sapif1j21900u0u14.jpg', 'http://ww2.sinaimg.cn/large/624c6377gy1gbu1sbxyxlj21900u0hdy.jpg', 'http://ww4.sinaimg.cn/large/624c6377gy1gbu1tventxj21900u0hdy.jpg', 'http://ww2.sinaimg.cn/large/624c6377gy1gbu1shsexwj21900u0x6v.jpg', 'http://ww2.sinaimg.cn/large/624c6377gy1gbu1slf0jqj21900u0u15.jpg', 'http://ww4.sinaimg.cn/large/624c6377gy1gbu1soi4blj21900u07wn.jpg', 'http://ww3.sinaimg.cn/large/624c6377gy1gbu1srwncij21900u04qv.jpg', 'http://ww1.sinaimg.cn/large/624c6377gy1gbu1svcl1uj21900u0u13.jpg', 'http://ww1.sinaimg.cn/large/624c6377gy1gbu1uezmvrj21900u0kjq.jpg']",,,"{'words': 99, 'sentences': 3, '好': 1, '乐': 0, '哀': 0, '怒': 0, '惧': 0, '恶': 0, '惊': 0}"
4471292940233583,ItUEC0YLt,5663561083,w自然而然w,疾控局：发现新冠肺炎病例时应停用空调通风系统O疾控局：发现新冠肺炎病例时应停用空调通风系统,,,,,0,0,0,2020-02-12 23:52,学习强国客户端,['http://ww1.sinaimg.cn/large/006bhIXpgy1gbu20gee4aj3046046a9w.jpg'],,,"{'words': 23, 'sentences': 1, '好': 0, '乐': 0, '哀': 0, '怒': 0, '惧': 2, '恶': 0, '惊': 0}"
4471292940238777,ItUEC107f,1688768145,拽拽愛美璃,#张流波所有消毒剂对新冠病毒都有效#是真的么别反转了,,,,张流波 所有消毒剂对新冠病毒都有效,0,0,1,2020-02-12 23:52,iPhone客户端,,,,"{'words': 16, 'sentences': 1, '好': 1, '乐': 0, '哀': 0, '怒': 0, '惧': 1, '恶': 0, '惊': 0}"
4471292936288138,ItUEBqnPA,5883410282,栀0906,"密织疫情防控网守好新疆东大门——哈密市建立完善疫情防控全流程规范体系点击上方蓝字,记得关注我们！新冠肺炎疫情发生以来，我市严格落实自治区党委“防、治、控、保、稳”工作方针，按照自治区重大突发公共卫生事件一级响应机制要求，构建横向到边、纵向到底的全域疫情防控体系，实化O密织疫情防控网守好新疆东大门——哈密市建立完善疫情防控全流程规范体系",,,,,0,0,0,2020-02-12 23:52,钉钉,['http://ww1.sinaimg.cn/large/006qabMely1gbu20et9qaj3046046q2v.jpg'],,,"{'words': 97, 'sentences': 2, '好': 7, '乐': 0, '哀': 0, '怒': 0, '惧': 0, '恶': 0, '惊': 0}"
4471292931810051,ItUEB7ASn,1750596453,jz009,#张流波所有消毒剂对新冠病毒都有效#记得之前专家说滴露成分无效，该信谁的,,,,张流波 所有消毒剂对新冠病毒都有效,0,3,4,2020-02-12 23:52,iPhone XS Max,,,,"{'words': 21, 'sentences': 1, '好': 2, '乐': 0, '哀': 0, '怒': 0, '惧': 1, '恶': 1, '惊': 0}"
4471292923648200,ItUEAfj3W,1644114654,新京报,【被治愈的二胎母亲：#黄石首例确诊孕妇治愈出院#】这是29岁的柯亮第二次当妈妈。#新型冠状病毒#一周之前，她从湖北黄石市妇幼保健院出院。除了“二胎妈妈”，她还带着一个特殊的身份：黄石首例被确诊感染新冠肺炎的孕产妇。面对新冠病毒的“袭击”，柯亮也说不清，到底是年轻的身体帮了她，还是凭借母爱扛了过来。总之，她得到了所有人期盼的结局：治愈归家，母女平安。@剥洋葱O被治愈的二胎母亲：黄石首例确诊孕妇治疗9天出院,,,剥洋葱,"黄石首例确诊孕妇治愈出院,新型冠状病毒",26,43,279,2020-02-12 23:52,微博 weibo.com,,,,"{'words': 128, 'sentences': 6, '好': 2, '乐': 1, '哀': 1, '怒': 0, '惧': 1, '恶': 0, '惊': 0}"
