id,bid,user_id,用户昵称,微博正文,头条文章url,发布位置,艾特用户,话题,转发数,评论数,点赞数,发布时间,发布工具,微博图片url,微博视频url,retweet_id,八种情感分析
4472018944909289,IudxAkB85,3725354495,永宁统计,#战胜新型冠状病毒#『银川市红十字会接受使用新冠肺炎疫情防控社会捐赠款物公示(第四批)』O银川市红十字会接受使用新冠肺炎疫情防控社会捐赠款物公示(第四批),,,,战胜新型冠状病毒,0,0,0,2020-02-14 23:57,iPhone客户端,,,,"{'words': 38, 'sentences': 1, '好': 2, '乐': 0, '哀': 0, '怒': 0, '惧': 0, '恶': 0, '惊': 0}"
4472018944916038,IudxAkCSW,3483556281,新津官方微博,【新津新闻】每天的新津都在这里（2020年2月14日）■天府农博主展馆一期工程于2月14日复工■拉紧“防护网”新津各小区实行封闭式管理■感动！新津兴义种植业主再捐30余吨蔬菜运至湖北■《新冠病毒肺炎公众预防指南》（一）旅游预防篇O【新津新闻】每天的新津都在这里（2020年2月14日）,,,,,0,0,0,2020-02-14 23:57,iPhone客户端,,,,"{'words': 89, 'sentences': 2, '好': 0, '乐': 0, '哀': 0, '怒': 0, '惧': 1, '恶': 0, '惊': 0}"
4472018936222740,Iudxzq6OM,5932101256,甘肃张伟,好消息！！！天水市已有9例新冠肺炎患者治愈出院！#吃中药后新冠肺炎患者紧张心理得到缓解##抗击新型肺炎第一线#,,天水·清水县,,"吃中药后新冠肺炎患者紧张心理得到缓解,抗击新型肺炎第一线",13,2,18,2020-02-14 23:57,HUAWEI Mate 20,"['http://ww3.sinaimg.cn/large/006tsuwwly1gbwddxb7v9j30qe0hl49o.jpg', 'http://ww1.sinaimg.cn/large/006tsuwwly1gbwddykz5jj30qe0gsn8y.jpg', 'http://ww4.sinaimg.cn/large/006tsuwwly1gbwddzwnhdj30qe0hidrj.jpg', 'http://ww2.sinaimg.cn/large/006tsuwwly1gbwde09q37j30qe0hlgu2.jpg', 'http://ww3.sinaimg.cn/large/006tsuwwly1gbwde0mks4j30qe0hdgwj.jpg', 'http://ww4.sinaimg.cn/large/006tsuwwly1gbwde0w26kj30qe0ivtik.jpg']",,,"{'words': 29, 'sentences': 3, '好': 1, '乐': 1, '哀': 0, '怒': 0, '惧': 1, '恶': 0, '惊': 0}"
4471655931928163,Iu46585Bp,3980966514,Cindy扣子,我家机械专业的理工男，天天琢磨国家大事儿，一有空就抓着生化专业的我，讨论新冠病毒作用机制，思考试剂盒的有效率，探讨疫苗开发周期以及药物阻断的可能性，甚至于说出了广谱抗病毒药的专业名词，时时刷新我对他的认知！让我很惭愧，我咋就不能通俗易懂地把病毒机制讲明白呢？咋就不能把疫苗开发、药物开发说的更清楚呢！总是一个问题接着一个问题～～此刻，我心中对科普作家的敬仰，真的如黄河，滔滔不绝…何以治愈？唯有美图！幽幽林中路，雪后静谧的琉璃塔，碧蓝如洗的天空，多令人怀念！惟愿疫情早点结束，医护平安归来，我们再去探美景、吃美食！愿望达成，当素食一周还此愿,,,,,0,0,1,2020-02-13 23:55,HUAWEI Mate 30 5G,"['http://ww2.sinaimg.cn/large/ed48ba72ly1gbv79wzr4nj23k02o0u0z.jpg', 'http://ww2.sinaimg.cn/large/ed48ba72ly1gbv79ykno5j22tc2407wi.jpg', 'http://ww3.sinaimg.cn/large/ed48ba72ly1gbv79z1iwgj21t219dh6i.jpg']",,,"{'words': 167, 'sentences': 8, '好': 3, '乐': 3, '哀': 1, '怒': 0, '惧': 3, '恶': 1, '惊': 0}"
4471655927478138,Iu464vnp8,2243650912,CaesarSash,#云自习挑战#✔️复习考研单词510个（u7-u14）🗒✔️写论文两个小时💻✔️电影《秋菊打官司》📽✔️读书《送你一颗子弹》📚♾♾♾♾♾♾♾♾♾♾♾♾老实说虽然新冠病毒让大家无法出门享乐，也打乱了大多数人的生活节奏，但用马克思的话说，它同时将许多人从“简单再生活”中解放出来，给了他们“扩大再生活”的机会，赤裸裸的福利。话虽这么说我还是希望上天能给我吃烤肉火锅喝奶茶的机会555,,,,云自习挑战,0,0,5,2020-02-13 23:55,iPhone客户端,"['http://ww4.sinaimg.cn/large/85bb6560ly1gbv7l0oeoqj227s27sb29.jpg', 'http://ww2.sinaimg.cn/large/85bb6560ly1gbv7l5khjlj21x31s6kjl.jpg']",,,"{'words': 127, 'sentences': 2, '好': 2, '乐': 0, '哀': 0, '怒': 0, '惧': 1, '恶': 2, '惊': 0}"
4471655927942945,Iu464xkk1,6140020713,汐圣2016,向专家请教一下，新冠病毒会通过患者血清样本传播吗？@疾控科普@曾光,,,"疾控科普,曾光",,0,0,0,2020-02-13 23:55,HUAWEI Mate 20,,,,"{'words': 20, 'sentences': 2, '好': 2, '乐': 1, '哀': 0, '怒': 0, '惧': 1, '恶': 0, '惊': 0}"
4471655918791983,Iu463ATcb,1672519561,东方今报,【重磅好消息！！！#治疗性新冠特免血浆制品投入临床#】日前，在新冠肺炎治疗方面传来重磅消息。#抗击疫情央企行动#国药@中国生物CNBG已完成对部分康复者血浆的采集工作，开展新冠病毒特免血浆制品和特免球蛋白的制备。经过严格的血液生物安全性检测，病毒灭活，抗病毒活性检测等，已成功制备出用于临床治疗的特免血浆！在各方紧密合作下，2月8日，以新型冠状病毒感染的肺炎诊疗方案（试行第五版）为指南，首期在江夏区第一人民医院开展了3名危重患者的新冠特免血浆治疗，目前连同后续医院治疗的危重病人超过了10人。临床反映，患者接受治疗12至24小时后，实验室检测主要炎症指标明显下降！淋巴细胞比例上升，血氧饱和度、病毒载量等重点指标全面向好，临床体征和症状明显好转。新冠特免血浆制品是由康复者捐献的含高效价新冠病毒特异性抗体的血浆，经过病毒灭活处理，并对抗新冠病毒中和抗体、多重病原微生物检测后制备而成，用于新冠肺炎危重患者的治疗。从临床病理发生过程看，大部分新冠肺炎患者经过治疗康复后，身体内会产生针对新冠病毒的特异性抗体，可杀灭和清除病毒。目前在缺乏疫苗和特效治疗药物的前提下，采用这种特免血浆制品治疗新冠病毒感染是最为有效的方法，可大幅降低危重患者病死率。（国资小新）,,,中国生物CNBG,"治疗性新冠特免血浆制品投入临床,抗击疫情 央企行动",2,3,10,2020-02-13 23:55,iPhone客户端,"['http://ww2.sinaimg.cn/large/63b09f89ly1gbv7p6c0akj20kw0f9tao.jpg', 'http://ww4.sinaimg.cn/large/63b09f89ly1gbv7p5zzpsj20u018z78l.jpg', 'http://ww4.sinaimg.cn/large/63b09f89ly1gbv7pmorraj20o10g70vu.jpg']",,,"{'words': 302, 'sentences': 11, '好': 6, '乐': 3, '哀': 2, '怒': 0, '惧': 9, '恶': 1, '惊': 0}"
4471655919047365,Iu463BXDf,5486325028,函函函函禹,即将迎来2020年的2月14日白色情人节被新冠肺炎疫情困了到现在还没上班，据说今天凌晨开始连续三天大暴雪还是很期待的27岁了一个人的白色情人节快乐❄️晚安,,,,,0,0,1,2020-02-13 23:55,iPhone客户端,,,,"{'words': 47, 'sentences': 1, '好': 0, '乐': 1, '哀': 0, '怒': 0, '惧': 0, '恶': 0, '惊': 0}"
4471655919294214,Iu463CZQG,7200301960,今日国土杂志社,【#女子隐瞒行程致65人被隔离#咳嗽发烧还上班、跟人吃火锅】1月27日，陈某某(女，54岁，南京溧水区人)从云南昆明返回南京后，未如实主动报告外省行程史，在咳嗽等症状加重后仍多次与他人密切接触、出入公共场所，且就诊时故意隐瞒外省行程史。2月9日，确诊为新冠肺炎，致65名密切接触者被隔离观察。2月10日，陈某某以涉嫌妨害传染病防治罪被立案侦查。L新闻360的微博视频,,,,女子隐瞒行程致65人被隔离,0,0,0,2020-02-13 23:55,Android,,"http://f.video.weibocdn.com/bOVWT2qMlx07AV2SuvEs01041200cH540E010.mp4?label=mp4_ld&template=640x360.25.0&trans_finger=40a32e8439c5409a63ccf853562a60ef&ori=0&ps=1BVp4ysnknHVZu&Expires=1611148668&ssig=ZHWOgxhJel&KID=unistore,video",,"{'words': 116, 'sentences': 4, '好': 2, '乐': 0, '哀': 0, '怒': 0, '惧': 0, '恶': 4, '惊': 0}"
4471655894514881,Iu461iWwF,1852842500,阿星立志当淑女,今天听我爸说，店里附近有个平房，两个老人在那里租住，是那种烧煤的房子，昨天晚上煤烟中毒两个老人双双离世。还有一个爸爸同学，昨天因为尿毒症也离世了，我过年前还跟那位阿姨通过话，帮她捎点东西到抚松路。还有最近在微博看见运动达人老大爷，还有某个艺术家，某些医护人员因为新冠肺炎离世。人的生命真的很短暂很脆弱，好好活着吧。,,,,,0,2,1,2020-02-13 23:55,iPhone客户端,,,,"{'words': 96, 'sentences': 5, '好': 1, '乐': 1, '哀': 1, '怒': 0, '惧': 0, '恶': 0, '惊': 0}"
4471655877668654,Iu45ZwaXY,6314908593,冷门视频合集,某小区，2人不服管理，当众围殴保安，结果被保安一一KO#湖北新增14840例新冠肺炎##湖北省委主要负责同志职务调整#L奇葩帖的微博视频,,,,"湖北新增14840例新冠肺炎,湖北省委主要负责同志职务调整",0,2,5,2020-02-13 23:55,微博 weibo.com,,"http://f.video.weibocdn.com/002SurUqgx07AUYFnOsL01041200bbow0E010.mp4?label=mp4_ld&template=360x624.24.0&trans_finger=81b11b8c5ffb62d33ceb3244bdd17e7b&ori=0&ps=1BVp4ysnknHVZu&Expires=1611148668&ssig=E%2FCZmTI8iP&KID=unistore,video",,"{'words': 36, 'sentences': 1, '好': 0, '乐': 0, '哀': 0, '怒': 0, '惧': 0, '恶': 0, '惊': 0}"
4471655864840880,Iu45YkjkI,2972820294,有的人到底在想什么呢,通了一晚上下水道了，已经被熏吐两次了。新冠病毒是不是还能气溶胶传播。真祸不单行。本来准备明天吃素一点的，现在决定明天中午炒只鸡、溜两截香肠、随便再炒个青菜鸡蛋我很积极，一点都不丧,,,,,0,1,0,2020-02-13 23:55,iPhone客户端,['http://ww4.sinaimg.cn/large/b131a346ly1gbv7o9i8zmj20c80be403.jpg'],,,"{'words': 55, 'sentences': 4, '好': 1, '乐': 0, '哀': 0, '怒': 0, '惧': 1, '恶': 1, '惊': 0}"
4471655865041874,Iu45Yl9Cy,1275582252,So小公举,#金银潭医院恳请康复患者捐献血浆#新冠病毒痊愈患者，愿意为疫情做点事提供自己的血浆。好棒！！！L-四分三十三秒-的微博视频,,,,金银潭医院恳请康复患者捐献血浆,4,1,12,2020-02-13 23:55,蔡徐坤的ikun,,"http://f.video.weibocdn.com/EH9cDv0jlx07AVFd3ZWg010412006Ulv0E010.mp4?label=mp4_ld&template=360x640.24.0&trans_finger=81b11b8c5ffb62d33ceb3244bdd17e7b&ori=0&ps=1BVp4ysnknHVZu&Expires=1611148668&ssig=7KR10PdfJS&KID=unistore,video",,"{'words': 37, 'sentences': 3, '好': 1, '乐': 1, '哀': 0, '怒': 0, '惧': 1, '恶': 0, '惊': 0}"
4471655848453747,Iu45WztcL,7272607771,大数据2020,《中央：强化中西医结合，促进中医药深度介入新冠肺炎诊疗》加快药物临床试验，有效的要抓紧向救治一线投放，提高治愈率、降低病亡率。O网页链接,,,,,0,0,0,2020-02-13 23:54,百度App,['http://ww2.sinaimg.cn/large/007Wb7vlgy1gbv7owcqhej301m01mt8h.jpg'],,,"{'words': 38, 'sentences': 2, '好': 3, '乐': 0, '哀': 0, '怒': 0, '惧': 1, '恶': 0, '惊': 0}"
4471655823193914,Iu45UdoSK,5455980352,只是你不认识我,#康复者血浆能有效杀死新冠病毒#为啥环球网的删除了，热搜也下去了,,,,康复者血浆能有效杀死新冠病毒,0,3,0,2020-02-13 23:54,荣耀8 美得与众不同,,,,"{'words': 20, 'sentences': 1, '好': 1, '乐': 0, '哀': 0, '怒': 0, '惧': 1, '恶': 0, '惊': 0}"
4471655806161124,Iu45SpQMY,6533136483,CC超ProlgueSU-FU37,停泊*日本横滨的钻石公主号邮轮，再多44人确诊感染新冠肺炎，包括一名船员，令船上感染人数增至218人。：那么，这个病毒的传染力还是非常强的！！：说白了，这就是一种*肺炎！！是一种*传染病啦1！！属于就是：肺病啦1！：*肺病的疾病：而且是*传染病！啥也不说啦！！那么：一定要更加的*小心的，*全方位的，*周全的，*立体式的，*抵制：任何人的防护啦！！！,,,,,0,4,4,2020-02-13 23:54,微博 weibo.com,['http://ww2.sinaimg.cn/large/00788nf5ly1gbv7m7gcaaj30l30h77lh.jpg'],,,"{'words': 120, 'sentences': 9, '好': 2, '乐': 0, '哀': 0, '怒': 0, '惧': 2, '恶': 1, '惊': 0}"
4471655806351287,Iu45SqEg7,6317392171,Dwdzg666,人民日报2月12日，14:29发出一条好消息，标题为#西藏唯一确诊病例治愈出院#，病例张某某于1月29日确诊为新冠肺炎，是西藏第一例，也是目前唯一一例确诊，几乎成为全国最受瞩目的新冠病例。随着张某某的治愈，西藏再次变回无一病例的人间净土！为啥西藏如此优秀？是因为海拔高吗？是因为外来人口少吗？当然这些都会有影响，但作为一名佛教徒，更相信这是三宝的加持，是善法的力量。,,,,西藏唯一确诊病例治愈出院,0,0,3,2020-02-13 23:54,vivo AI智慧拍照X21,['http://ww2.sinaimg.cn/large/006Tx8i7ly1gbv7oqjsf1j30s60e3myy.jpg'],,,"{'words': 112, 'sentences': 7, '好': 4, '乐': 0, '哀': 0, '怒': 0, '惧': 4, '恶': 0, '惊': 0}"
4471655789517309,Iu45QDVSZ,3817346948,Siew王木木,很不理解。武汉封城在1月23日，可是这位从武汉来的中国游客在25日抵达马来西亚，今天确诊，成为马来西亚第19位新冠确诊病人。😧,,,,,0,1,3,2020-02-13 23:54,iPhone,"['http://ww1.sinaimg.cn/large/e3881784gy1gbv7ls0vnfj20ku112aw7.jpg', 'http://ww2.sinaimg.cn/large/e3881784gy1gbv7lu7sl6j20ku112q6n.jpg']",,,"{'words': 38, 'sentences': 3, '好': 1, '乐': 0, '哀': 0, '怒': 0, '惧': 0, '恶': 0, '惊': 0}"
4471655784568261,Iu45QjapD,6529339450,宝贝的秘密基地一,#新冠肺炎康复者血浆治疗超10人#超好的消息啊,,,,新冠肺炎康复者血浆治疗超10人,0,0,0,2020-02-13 23:54,iPhone客户端,,,,"{'words': 14, 'sentences': 1, '好': 0, '乐': 0, '哀': 1, '怒': 0, '惧': 0, '恶': 0, '惊': 0}"
4471655768722281,Iu45OAB3X,2104693617,二三里重庆,【#治疗性新冠特免血浆制品已投入临床#：患者重点指标向好，临床体征和症状好转】日前，国药中国生物已完成对部分康复者血浆的采集工作，开展新冠病毒特免血浆制品和特免球蛋白的制备。经过严格的血液生物安全性检测，病毒灭活，抗病毒活性检测等，已成功制备出用于临床治疗的特免血浆，在中国生物武汉生物制品研究所、国药集团武汉血液制品有限公司、武汉市江夏区第一人民医院、武汉血液中心、中科院武汉病毒研究所、中国食品药品检定研究院的紧密合作下，投入临床救治重症患者。2月8日，以新型冠状病毒感染的肺炎诊疗方案（试行第五版）为指南，首期在江夏区第一人民医院开展了3名危重患者的新冠特免血浆治疗，目前连同后续医院治疗的危重病人超过了10人。临床反映，患者接受治疗12至24小时后，实验室检测主要炎症指标明显下降，淋巴细胞比例上升，血氧饱和度、病毒载量等重点指标全面向好，临床体征和症状明显好转。新冠特免血浆制品是由康复者捐献的含高效价新冠病毒特异性抗体的血浆，经过病毒灭活处理，并对抗新冠病毒中和抗体、多重病原微生物检测后制备而成，用于新冠肺炎危重患者的治疗。从临床病理发生过程看，大部分新冠肺炎患者经过治疗康复后，身体内会产生针对新冠病毒的特异性抗体，可杀灭和清除病毒。目前在缺乏疫苗和特效治疗药物的前提下，采用这种特免血浆制品治疗新冠病毒感染是最为有效的方法，可大幅降低危重患者病死率。O重磅消息！中国生物治疗性新冠特免血浆制品投入临床,,,,治疗性新冠特免血浆制品已投入临床,0,1,3,2020-02-13 23:54,前后2000万 OPPO R11,"['http://ww1.sinaimg.cn/large/7d731371ly1gbv7okiqgfj20u012kwm0.jpg', 'http://ww1.sinaimg.cn/large/7d731371ly1gbv7olhzoqj20kt0f9jth.jpg']",,,"{'words': 339, 'sentences': 9, '好': 7, '乐': 3, '哀': 2, '怒': 0, '惧': 11, '恶': 1, '惊': 0}"
4471655764504930,Iu45OiTWa,2291416522,我爱含羞草的美,新冠肺炎康复者特异血浆是治疗新冠肺炎最有效的方法。,,,,,0,0,0,2020-02-13 23:54,小米Max3 大屏大电量,['http://ww2.sinaimg.cn/large/88943dcaly1gbv7of3e5aj20es0d80tu.jpg'],,,"{'words': 14, 'sentences': 2, '好': 1, '乐': 0, '哀': 0, '怒': 0, '惧': 0, '恶': 0, '惊': 0}"
4472018919024718,IudxxBRJY,1499104401,新浪军事,【#长春一药店工作人员确诊#，急寻17天内去过的顾客】2月14日，吉林长春。吉林新增2例新冠肺炎确诊病例中，一例1月28日在吉林大药房迅驰广场店与确诊病例有接触史。2月4日被隔离观察，2月13日由疑似病例转为确诊病例。急寻从1月28日到2月13日去过该药店的居民。L一手video的秒拍视频@一手Video#吃中药后新冠肺炎患者紧张心理得到缓解#,,,一手Video,"长春一药店工作人员确诊,吃中药后新冠肺炎患者紧张心理得到缓解",25,7,63,2020-02-14 23:57,小米MIX 2 全面屏手机,,"http://miaopai.video.weibocdn.com/8ejoFDZFlx07AX7f2PfW010412004TWy0E013.mp4?label=mp4_ld&template=640x360.25.0&trans_finger=40a32e8439c5409a63ccf853562a60ef&ori=0&ps=1BVp4ysnknHVZu&Expires=1611148668&ssig=G0c0ZXe9ay&KID=unistore,video",,"{'words': 107, 'sentences': 5, '好': 0, '乐': 1, '哀': 0, '怒': 0, '惧': 4, '恶': 0, '惊': 0}"
4472018919641658,IudxxEseC,2275345674,人民网云南频道,【湖南省纪委通报：张家界#疾控中心科长到泰国躲疫情被撤职#调查】湖南省纪委通报张家界市疾控中心慢性非传染性疾病防治科科长李文杰擅离职守、临阵脱逃，携家人到泰国躲避疫情问题。2020年1月21日，李文杰被抽调到张家界市新冠肺炎疫情防控指挥部，负责疫情信息报送工作。在获悉该市出现一例确诊病例后，李文杰害怕自己及家人被感染，遂从单位取走个人护照，于1月30日携家人乘飞机到泰国躲避。期间，李文杰向单位谎称其母亲和武汉有关人员有接触，自己在老家自行隔离。经多次劝返，李文杰于2月9日下午乘飞机从泰国回到张家界。经查，李文杰对组织不忠诚不老实，擅离职守、临阵脱逃，严重违反政治纪律、组织纪律，给予其撤职处分，涉及其他问题在进一步调查中。市疾控中心党办工作人员熊月凤、市卫健委人事科科长伍燕未严格执行护照集中保管有关规定，被分别给予党内严重警告、党内警告处分。（人民日报记者何勇）,,,,疾控中心科长到泰国躲疫情被撤职,0,0,0,2020-02-14 23:57,人民网Android,['http://ww4.sinaimg.cn/large/879f050agy1gbwde0oh29j20fr0fraax.jpg'],,,"{'words': 207, 'sentences': 8, '好': 3, '乐': 0, '哀': 0, '怒': 0, '惧': 2, '恶': 5, '惊': 0}"
4472018910589295,Iudxx2tiL,5043101733,都江堰司法,#关注新冠肺炎#【#湖北洪湖实施战时封闭管理#：中心城区隔断所有通道】为应对当前疫情发展严峻形势，控制人员流动和车辆通行，彻底阻断疫情传播，根据《传染病防治法》、《治安管理处罚法》和《突发公共卫生事件应急条例》等相关法律法规，市疫情防控指挥部决定从即日起，在全市范围全面升级管控措施。现紧急通告如下：一、所有乡镇（村、社区）、中心城区（镇区）小区（居民点）一律实行全封闭管理。中心城区（镇区）要分别隔断社区与社区、里弄与里弄、小区与小区、楼栋与楼栋之间的所有通道；各村（社区）要分别隔断村与村、组与组、自然村与自然村、墩湾与墩湾之间的所有通道。除医护人员、抗疫工作人员和水电油气、通讯网络、粮食蔬菜、医药物资等基本民生保障从业人员之外，其他居民一律不得进出小区（居民点、楼栋），中心城区原通行证一律废止。二、所有车辆一律从严管控。除医疗救护车辆、抗疫工作车辆、运输医疗救护物资和居民生活必需品的车辆、消防、抢险、环卫、警车等特种车辆之外，其它车辆一律禁止通行。不再办理以上车辆以外的车辆通行证。三、全市居民基本生活必需物资、急需药品（感冒、咳嗽药品之外）实行全代购配送服务，定点超市、集贸市场、药店只准对代购配送员开放，一律不得对外营业。全市城乡统一配备足够的代购配送员，由市镇村（社区）干部、财政供养人员担任。代购配送员每三天为每户居民提供一次代购配送服务，特殊应急情形的要及时处理到位。四、公安机关对强行冲闯、破坏小区、道路出入口设置的隔离、警戒、封控设施的，一律依法从重从快予以打击。（中国新闻网）,,,,"关注新冠肺炎,湖北洪湖实施战时封闭管理",0,0,1,2020-02-14 23:57,荣耀V20 4800万3D相机,,,,"{'words': 373, 'sentences': 13, '好': 8, '乐': 2, '哀': 1, '怒': 0, '惧': 2, '恶': 1, '惊': 0}"
4472018906383250,IudxwqMzE,2503569810,Ssss等月光落雪地,迷惑？？？#吃中药后新冠肺炎患者紧张心理得到缓解#,,,,吃中药后新冠肺炎患者紧张心理得到缓解,0,0,2,2020-02-14 23:57,微博国际版,['http://ww2.sinaimg.cn/large/95397192gy1gbwddzu1bnj20j60j6ab7.jpg'],,,"{'words': 15, 'sentences': 2, '好': 0, '乐': 1, '哀': 0, '怒': 0, '惧': 1, '恶': 0, '惊': 0}"
4472018898869797,IudxvBdrf,2307703630,小甜兔zZ,中午看了一个武汉博主的vlog，他是给患病的人送药的志愿者，他去给一个两天前预定药的女孩送药的时候，没想到她的父亲感染了新冠肺炎去世，没有等来药也没有等到早一点的救治，女孩在路边崩溃大哭说“我没有爸爸了，我以后怎么办啊”。我没法写出视频给我的冲击，我难过地和视频中的女孩一起哭了起来。人是最能适应苦难的动物，时间一长，连带着神经末梢也麻木了起来，我们局外人习惯了世界的操蛋，只剩下上万个家庭他们习惯不了，因为只有他们身处地狱。还是要保持敏感吧，灾难并不是死了两万人这样一件事，而是死了一个人这件事，发生了两万次。,,,,,1,3,8,2020-02-14 23:57,iPhone 8,,,,"{'words': 164, 'sentences': 5, '好': 1, '乐': 2, '哀': 2, '怒': 0, '惧': 1, '恶': 5, '惊': 0}"
4472018898227885,IudxvywrP,2723712731,春风ufo,什么是新型冠状病毒？什么人会传染它？具体的感染症状是什么？关于潜伏期、关于传染、关于预防、关于“特效药”…一图带你完整了解新型冠状病毒感染肺炎的30个真相！转发收藏！助你科学防疫！『转扩！关于新冠肺炎的30个真相』O推荐#,,,,,0,0,1,2020-02-14 23:57,华为手机 畅享玩不停,,,,"{'words': 67, 'sentences': 8, '好': 2, '乐': 0, '哀': 0, '怒': 0, '惧': 0, '恶': 0, '惊': 0}"
4472018898221842,IudxvyuSm,3804173419,各界导报社官微,#关注新冠肺炎#【专家：#吃中药后新冠肺炎患者紧张心理得到缓解#】国家中医药管理局医疗救治专家组组长、中国工程院院士、中国中医科学院院长黄璐琦14日介绍，在新冠肺炎患者救治中，老百姓对中医药有种迫切需求，吃了中医药后紧张心理得到一定程度缓解。他说，根据临床调查，重症患者有80%愿意接受中医药治疗，轻症患者有90%愿意接受中医药干预，隔离的患者也希望中医药早期介入。,,,,"关注新冠肺炎,吃中药后新冠肺炎患者紧张心理得到缓解",0,1,1,2020-02-14 23:57,vivo 全新水滴屏手机,['http://ww4.sinaimg.cn/large/e2bf146bly1gbwddy04uvj20j60kr0tz.jpg'],,,"{'words': 97, 'sentences': 3, '好': 7, '乐': 4, '哀': 0, '怒': 0, '惧': 2, '恶': 0, '惊': 0}"
4472018894373641,IudxvilMB,2798156675,北海新闻网,#北海分享#【好消息！#浙江一96岁确诊奶奶治愈出院#】13日下午，一位96岁高龄的新冠肺炎患者从浙大一院之江院区治愈出院，回到当地继续接受隔离、康复，她也是目前浙江最高龄的新冠肺炎患者。这位患者从当地医院转运至浙大一院之江院区，由于年龄大，肺部影像炎症改变明显，氧饱和度较低，所以直接转入ICU进行治疗。经过抗病毒治疗，适当使用激素，同时进行高流量吸氧等，该患者病情逐渐好转，病毒核酸检测连续两次阴性，氧饱和度好转，肺CT吸收好转，体温正常。O浙大一院96岁新冠肺炎患者治愈出院或全国最高龄 L人民日报的微博视频,,,,"北海分享,浙江一96岁确诊奶奶治愈出院",0,0,2,2020-02-14 23:57,Redmi K30 全速热爱,,"http://f.video.weibocdn.com/yM3nIInBlx07AX3bULK80104120097Ho0E010.mp4?label=mp4_ld&template=624x360.25.0&trans_finger=40a32e8439c5409a63ccf853562a60ef&ori=0&ps=1BVp4ysnknHVZu&Expires=1611148668&ssig=ZfEdadcExy&KID=unistore,video",,"{'words': 152, 'sentences': 5, '好': 1, '乐': 1, '哀': 1, '怒': 0, '惧': 1, '恶': 0, '惊': 0}"
